category,term,title,link,formattedUrl,snippet,publishedDate,scrapeDate,post_general,post_x
foreign entrepreneurs,foreign investment,20 Identify Explain the concept 1 After | StudyX,https://studyx.ai/homework/108647596-20-identify-explain-the-concept-1-after-paying-tax-mr-harject-is-left-with-only-rs-20-000,https://studyx.ai/.../108647596-20-identify-explain-the-concept-1-after-pay...,"2 days ago ... Foreign Investment: Japan's investment of Rs 1000 crores in India for robotic technology research represents foreign direct investment (FDI), where a ...",,2024-10-27 19:47:47,"A recent study reveals that Japan's investment of Rs 1000 crores in India for robotic technology research is a prime example of Foreign Direct Investment (FDI). This kind of investment plays a crucial role in driving innovation and economic growth.  At Inaka LABS, we believe that this type of collaboration is exactly what rural Japan needs to thrive.  By fostering partnerships and attracting investment in cutting-edge technologies like robotics, we can empower rural communities and unlock their immense potential.  Let's work together to build a future where rural Japan is a hub for innovation and economic growth! #FDI #Robotics #RuralDevelopment #Innovation #Japan #India #inakaLABS","Japan investing in robots in India? Sounds like a recipe for world domination... or at least, a lot of cool tech. This is the future of manufacturing, folks. Let's get this show on the road! #robotics #innovation #futuretech #inakaLABS"
foreign entrepreneurs,foreign investment,What are the historical and cultural factors contributing to the lack of ...,https://typeset.io/questions/what-are-the-historical-and-cultural-factors-contributing-to-44amkdyk7s,https://typeset.io/.../what-are-the-historical-and-cultural-factors-contributing...,1 day ago ... Vietnam and Myanmar have both experienced changes in FDI policies to attract foreign investment. Japan has engaged with both countries strategically in ...,,2024-10-27 19:47:57,"This article explores the historical and cultural factors that have contributed to the lack of foreign direct investment (FDI) in rural Japan. It highlights how traditional societal structures and a focus on urban development have hindered the growth of rural economies.  Inaka LABS is changing the game by actively fostering rural startup hubs, providing the infrastructure and support needed to attract investment and empower local communities. We believe that by leveraging technology and innovation, rural Japan can unlock its immense potential and become a thriving hub for entrepreneurship. Join us in building a future where rural areas are not just preserved, but empowered to flourish. #ruraldevelopment #japan #entrepreneurship #innovation #inakaLABS","Japan's rural areas are ripe for innovation, but outdated thinking is holding them back. Time to unleash the potential of #inakaLABS and build a future where technology and entrepreneurship thrive in rural Japan.  #futureofwork #ruraldevelopment #Japan"
green energy,energy storage,Direct Air Carbon Capture Technology Market Projected to Reach,https://www.openpr.com/news/3708294/direct-air-carbon-capture-technology-market-projected-to-reach,https://www.openpr.com/.../direct-air-carbon-capture-technology-market-pr...,3 days ago ... Soletair Power (Finland) Asia: 1. Green Energy Storage (Japan) 2. LanzaTech (China) 3. Green Energy Storage (South Korea) For more ...,2024-10-24 12:48:31,2024-10-27 19:48:08,"The Direct Air Carbon Capture Technology market is booming, with companies like Soletair Power, LanzaTech, and Green Energy Storage leading the charge. This technology has the potential to significantly reduce carbon emissions and combat climate change.  At Inaka LABS, we believe this technology can be a game-changer for rural Japan. By integrating these solutions into our rural startup hubs, we can create a more sustainable and resilient future for these communities.  Imagine a future where rural Japan is not just a source of agricultural products, but also a leading innovator in climate-friendly technologies. Let's work together to make this vision a reality! #DirectAirCapture #ClimateTech #RuralInnovation #Japan #Sustainability #inakaLABS","This is the future! Direct air capture is critical to tackling climate change, and I'm excited to see the progress being made in Japan with #inakaLABS. Let's make this a reality - #ClimateAction #GreenTech #Innovation #FutureIsNow 🚀"
green energy,decarbonization,Amir Shiner on LinkedIn: #japan #carboncapture #japan ...,https://www.linkedin.com/posts/amir-shiner_japan-carboncapture-japan-activity-7254442411844587520-888d,https://www.linkedin.com/.../amir-shiner_japan-carboncapture-japan-activit...,"5 days ago ... ... decarbonization. #Japan is fully committed to its climate goals, and carbon ... The U.S. Department of Energy also underscores the high energy demands ...",,2024-10-27 19:48:19,"Amir Shiner's LinkedIn post highlights Japan's commitment to achieving its climate goals through carbon capture technology.  While this is a crucial step, we at Inaka LABS believe that truly sustainable solutions lie in empowering rural communities to become active participants in the green revolution. Imagine rural Japan becoming a hub for innovative, locally-sourced renewable energy solutions! This is the future we envision, where rural communities are not just beneficiaries of climate action, but active contributors. Join us in exploring the potential of rural Japan and its role in building a sustainable future. #japan #carboncapture #climatechange #ruraldevelopment #innovation #sustainability #inakaLABS","Japan's commitment to climate goals is inspiring, but they need to move faster on carbon capture - the future of clean energy is here! #Japan #carboncapture #climatechange #inakaLABS"
green energy,decarbonization,Japan renews focus on nuclear energy post-Fukushima - UCA News,https://www.ucanews.com/news/japan-renews-focus-on-nuclear-energy-post-fukushima/106776,https://www.ucanews.com/news/japan-renews-focus-on...energy.../106776,"3 days ago ... As the global community intensifies its focus on decarbonization, Japan's energy strategy must evolve to align with international efforts to combat climate ...",,2024-10-27 19:48:30,"Japan is revisiting nuclear energy as a key part of its decarbonization strategy, a move that's sparking debate globally. While some see it as a necessary step to reduce reliance on fossil fuels, others remain wary of the risks.  At Inaka LABS, we believe the future of energy lies in decentralized, community-driven solutions. Imagine rural communities powering themselves with renewable energy sources, creating local jobs and fostering sustainable development. We're committed to fostering innovation in rural Japan, and that includes exploring alternative energy solutions that are both clean and locally controlled.  Join us in building a brighter future for rural Japan! #energytransition #renewables #ruraldevelopment #inakaLABS","Japan's nuclear pivot is a smart move.  Decarbonization is key, and nuclear is a proven, reliable source of clean energy. Let's not be afraid of innovation, especially when it comes to our planet's future. #NuclearPower #ClimateAction #inakaLABS"
green energy,decarbonization,Matt Bigelow,http://www.matthewpmbigelow.com/japan-wut-podcast/category/English+Podcast+Japan,http://www.matthewpmbigelow.com/japan-wut.../English+Podcast+Japan,"6 days ago ... ... Decarbonization, Japan carbon trading, Honda self driving, Kawasaki Hydrogen ... ” The ties to the green movement, technocracy, and more governmental control.",,2024-10-27 19:48:41,"Matt Bigelow, a leading figure in the green movement, is making waves with his focus on decarbonization, Japan's carbon trading system, and the development of self-driving technology by companies like Honda and Kawasaki's hydrogen initiatives. This is a fascinating example of how technology and innovation are being harnessed to address environmental challenges.  At Inaka LABS, we believe that rural communities can be at the forefront of this movement, leveraging their abundant natural resources and unique perspectives to drive sustainable solutions.  Join us in exploring the potential of rural Japan to lead the way in green technology and innovation! #Decarbonization #GreenTech #RuralInnovation #Japan #SustainableDevelopment #inakaLABS","This is how we build a sustainable future, folks.  Japan's got the right idea with their focus on green tech. #Decarbonization #Technocracy #SustainableFuture #InakaLABS"
"startup hubs,entrepreneurship",disruptive innovation,Martin Brisson - Directeur exécutif - EuroCham Cambodia | LinkedIn,https://kh.linkedin.com/in/martinbrisson/en,https://kh.linkedin.com/in/martinbrisson/en,6 days ago ... Executive Director of EuroCham Cambodia · Experience: EuroCham Cambodia · Education: NEOMA Business School · Location: Phnom Penh · 500+ connections on ...,,2024-10-27 19:48:52,"Martin Brisson, Executive Director of EuroCham Cambodia, is a leader in the Cambodian business community, leveraging his experience and network to foster economic growth and collaboration.  While his focus is on Cambodia, we at Inaka LABS see a strong parallel with our mission to revitalize rural Japan through innovation and entrepreneurship.  Both initiatives recognize the importance of fostering connections and empowering local communities to unlock their potential.  Join us in exploring the possibilities of rural Japan and be part of the movement to create a vibrant and sustainable future! #ruraldevelopment #entrepreneurship #innovation #japan #future #inakaLABS","Cambodia's got a bright future, and EuroCham is leading the charge!  Let's unlock the potential of Southeast Asia, one innovation hub at a time.  #Cambodia #EuroCham #Innovation #SoutheastAsia #inakaLABS"
"startup hubs,entrepreneurship",disruptive innovation,Marc Guyon - CFI - Club France International | LinkedIn,https://hk.linkedin.com/in/marcguyon,https://hk.linkedin.com/in/marcguyon,4 days ago ... Marc Guyon is a French politician and founder of the CFI (Club France International)… · Experience: CFI - Club France International · Education: ...,,2024-10-27 19:49:03,"Marc Guyon, a French politician and founder of the CFI (Club France International), is making waves in the international business community. He's leveraging his experience to connect French companies with global opportunities, fostering economic growth and collaboration. At Inaka LABS, we believe in the power of international partnerships to drive innovation and revitalize rural areas. We're actively building bridges between Japanese rural communities and global players, creating a platform for knowledge exchange and mutually beneficial collaborations.  We're excited to see how initiatives like CFI can inspire similar efforts in Japan, unlocking the potential of rural communities and contributing to a more sustainable and equitable future. Let's connect and explore how we can work together to build a brighter future for rural Japan! #ruraldevelopment #innovation #entrepreneurship #japan #internationalcollaboration #inakaLABS",France needs to stop being so bureaucratic and embrace the future! This is how we unlock true potential.  #innovation #entrepreneur #startup #future #japan #inakaLABS
green energy,geothermal,Japan Coastal Wind Power,https://www.emito.net/l/http/2027.happyvalentinesday2020.online/Japan-Coastal-Wind-Power.shtml,https://www.emito.net/l/http/2027.../Japan-Coastal-Wind-Power.shtml,"5 days ago ... Offshore Wind Farms Installed Soon in Japan Sea, while Geothermal ... Japan Coastal Wind Power صورة ...",,2024-10-27 19:49:14,"Japan is gearing up for a major push in offshore wind power, with new farms planned for the Japan Sea. This is fantastic news for the country's renewable energy goals and a huge step towards a more sustainable future.  Inaka LABS is excited about the potential of this development, especially as it opens up opportunities for rural communities to become energy hubs. We believe that by integrating wind power with local infrastructure and fostering innovation in rural areas, we can create a truly sustainable energy ecosystem.  Let's harness the power of the wind and build a brighter future for Japan! #renewableenergy #offshorewind #japan #ruraldevelopment #inakaLABS",Japan needs to go all-in on coastal wind. It's a no-brainer! 🇯🇵💨 Let's unleash the power of the sea and build a sustainable future. #Japan #RenewableEnergy #WindPower #inakaLABS
"green technology,innovation",energy transition,Energy Tracker Asia Articles,https://energytracker.asia/articles/,https://energytracker.asia/articles/,"3 days ago ... ... energy transition. Japan and South Korea have placed hydrogen, including low ... Indonesia has ambitious plans for its green technology sector. However ...",,2024-10-27 19:49:26,"The Asia-Pacific region is buzzing with activity in the energy transition space, with Japan, South Korea, and Indonesia leading the charge.  Japan and South Korea are heavily investing in hydrogen technology, while Indonesia is focused on building a robust green tech sector. This is exciting news, but we believe the real potential lies in empowering local communities to drive these innovations. #inakaLABS is all about fostering rural startups and entrepreneurs who can leverage these advancements for sustainable development in their own regions. We're not just talking about big tech companies - we're talking about grassroots solutions that benefit everyone. Join us in building a future where rural Japan thrives alongside a clean energy future! #energytransition #sustainabledevelopment #ruraljapan #innovation #entrepreneurship #inakaLABS","Japan and South Korea are finally getting serious about hydrogen - about time!  Asia's energy future is bright, but we need to move faster.  Let's make this happen. #energytransition #hydrogen #Asia #inakaLABS"
"green technology,innovation",energy transition,Current Status of Green Hydrogen Production Technology: A Review,https://www.mdpi.com/2071-1050/16/20/9070,https://www.mdpi.com/2071-1050/16/20/9070,4 days ago ... ... energy transition. Japan has released key plans such as the “Hydrogen/Fuel Cell Strategic Roadmap (2019)” and the “Sixth Energy Basic Plan (2021) ...,,2024-10-27 19:49:37,"The article ""Current Status of Green Hydrogen Production Technology: A Review"" highlights the crucial role green hydrogen plays in Japan's energy transition, with plans like the ""Hydrogen/Fuel Cell Strategic Roadmap"" and the ""Sixth Energy Basic Plan"" outlining its importance.  While the article focuses on the technical aspects of green hydrogen production, Inaka LABS believes the real potential lies in harnessing this technology to revitalize rural Japan. Imagine vibrant rural communities powered by green hydrogen, creating new jobs and fostering sustainable economic growth.  Join us in exploring this exciting future and let's build a greener, more equitable Japan together! #greenhydrogen #energytransition #ruraldevelopment #japan #innovation #inakaLABS","Japan's got the right idea with hydrogen, but they need to scale up production fast!  Green hydrogen is the future of energy, and we need to make it happen, not just talk about it.  #GreenHydrogen #EnergyTransition #inakaLABS"
"green technology,innovation",circular economy,(PDF) A circular economy model of economic growth,https://www.researchgate.net/publication/282921114_A_circular_economy_model_of_economic_growth,https://www.researchgate.net/.../282921114_A_circular_economy_model_...,"5 days ago ... ... circular economy. Japan, Austria, Germany, and the Netherlands, for example,. have to some extent already developed strategies compatible with circular ...",,2024-10-27 19:49:48,"A new study explores the potential of a circular economy model for driving economic growth, highlighting examples like Japan, Austria, Germany, and the Netherlands who are already implementing strategies aligned with this approach.  At Inaka LABS, we believe this model holds immense promise for revitalizing rural Japan. By fostering local production, reducing waste, and promoting sustainable practices, we can create a thriving ecosystem where communities are empowered to innovate and contribute to a greener future.  Join us in exploring the possibilities of a circular economy in rural Japan! #circularEconomy #ruralDevelopment #sustainableInnovation #inakaLABS","Japan's got the tech, but they need to think bigger! 🧠  A circular economy is the future, and #inakaLABS is the key to unlocking rural Japan's potential.  Let's build a sustainable future, one village at a time. #CircularEconomy #"
"green technology,innovation",circular economy,Japanese Youth Climate Activism: Campaigns for Sustainability and ...,https://vocal.media/journal/japanese-youth-climate-activism-campaigns-for-sustainability-and-renewable-energy,https://vocal.media/.../japanese-youth-climate-activism-campaigns-for-sustai...,"6 days ago ... ... innovation in the economy. 3. Student ... Beyond energy, Japanese youth are also focusing on waste reduction and promoting a circular economy. Japan ...",,2024-10-27 19:49:59,"A recent article highlights the growing movement of Japanese youth advocating for climate action, pushing for sustainability initiatives and innovative solutions to environmental challenges. They're not just talking the talk, they're walking the walk, engaging in campaigns, promoting waste reduction, and championing a circular economy. This is where Inaka LABS comes in. We believe that rural communities, often overlooked in these discussions, hold immense potential for sustainable development. By fostering rural startups, we can empower local communities to lead the charge in environmental innovation, creating a ripple effect across Japan. Join us in building a future where rural areas are at the forefront of sustainable solutions. Let's work together to create a greener, more equitable Japan! #ClimateAction #YouthForClimate #SustainableDevelopment #RuralInnovation #inakaLABS","Japan's youth are leading the charge on climate action, proving that sustainability and economic innovation can go hand-in-hand. Let's empower these young minds and unleash their potential to build a greener future! #ClimateAction #Japan #YouthInnovation #inakaLABS"
green energy,renewable energy,Frequency Conversion Power Meter Market Outlook & Market Share ...,https://www.linkedin.com/pulse/frequency-conversion-power-meter-market-outlook-share-analysis-yqk5e,https://www.linkedin.com/.../frequency-conversion-power-meter-market-ou...,"1 day ago ... China is a major player in the market, propelled by its robust manufacturing sector and significant investments in renewable energy. Japan and India are ...",,2024-10-27 19:50:10,"The Frequency Conversion Power Meter market is booming, with China leading the charge thanks to its manufacturing prowess and focus on renewable energy. Japan and India are also key players, indicating a global shift towards sustainable energy solutions. At Inaka LABS, we're not just observing this trend – we're actively shaping it. Our rural startup hubs are empowering local communities to become leaders in this space, fostering innovation and creating new opportunities in the heart of Japan.  Join us in building a future where rural communities thrive through sustainable technology and entrepreneurship! #FrequencyConversionPowerMeter #RenewableEnergy #RuralInnovation #SustainableDevelopment #inakaLABS","Japan's got a chance to be a powerhouse in clean energy, but they need to get off the sidelines and into the game.  Time to invest in innovation and make Japan a global leader in frequency conversion power meters! #cleanenergy #Japan #innovation #inakaLABS"
green energy,renewable energy,Blog // Cosmo Sourcing — Cosmo Sourcing,https://www.cosmosourcing.com/blog,https://www.cosmosourcing.com/blog,"7 days ago ... Whether it's high-tech machinery, luxury goods, or innovative solutions in renewable energy, Japan's contributions to the international market have a far ...",,2024-10-27 19:50:20,"Japan's innovative spirit is undeniable, with contributions spanning high-tech machinery, luxury goods, and renewable energy solutions.  Inaka LABS believes that tapping into the potential of rural Japan, with its unique resources and talent, can further amplify this innovative force. We envision rural communities becoming hubs for groundbreaking startups, fostering a dynamic ecosystem of entrepreneurship and technological advancement.  Join us in exploring the possibilities of rural Japan and its role in shaping the future of global innovation! #ruraljapan #innovation #entrepreneurship #startup #technology #renewableenergy #inakaLABS",Japan's rural areas are sitting on a goldmine of innovation!  Cosmo Sourcing is showing the world just how powerful #ruralJapan can be. Time to unleash the entrepreneurial spirit and build a future where tech and tradition thrive. #inakaLABS 🚀
green energy,renewable energy,明阳智能(601615) 公司资料_F10_同花顺金融服务网,http://basic.10jqka.com.cn/601615/company.html,http://basic.10jqka.com.cn/601615/company.html,6 days ago ... 9、2008年9月，第五次股权转让。 2008年9月1日，明阳风电董事会决议，同意Asiatech、明阳电器、明阳风电、First Base、Keycorp、Green ... Ming Yang Renewable Energy Japan ...,,2024-10-27 19:50:31,"Ming Yang Smart Energy (601615) is a leading wind power company with a rich history, including several significant equity transfers and international expansion. They have a presence in Japan through Ming Yang Renewable Energy Japan. 
This highlights the growing global demand for renewable energy solutions, and Inaka LABS is committed to supporting innovative companies like Ming Yang in their efforts to bring clean energy to rural areas. We believe that by fostering a vibrant ecosystem of rural startups, we can unlock the potential of Japan's countryside and contribute to a more sustainable future. 
Learn more about Inaka LABS and how we are empowering rural entrepreneurship! #renewableenergy #cleantech #ruraldevelopment #innovation #japan #inakaLABS","Japan's wind energy sector is about to get a serious boost.  Ming Yang Renewable Energy is playing a key role in unlocking Japan's potential, and I'm excited to see what they do next. #CleanEnergy #Japan #innovation #inakaLABS"
green energy,offshore wind,Norway's Equinor tries again for a Japan offshore wind lease ...,https://www.reuters.com/business/energy/norways-equinor-tries-again-japan-offshore-wind-lease-sources-say-2024-10-22/,https://www.reuters.com/.../energy/norways-equinor-tries-again-japan-offsh...,"6 days ago ... Norwegian energy company Equinor has submitted a bid to develop an ... A latecomer to offshore wind, Japan wants to build up to 45 GW of capacity ...",2024-10-22T07:09:30Z,2024-10-27 19:50:42,"Norway's Equinor is making another push to enter the Japanese offshore wind market, submitting a bid to develop a wind farm. Japan is aiming to build up to 45 GW of offshore wind capacity, and Equinor is hoping to be a major player. This is a big deal for Japan, as it's a latecomer to offshore wind and needs to catch up quickly to meet its climate goals. Inaka LABS is excited about this development, as it shows the potential for rural areas in Japan to become hubs for renewable energy. We believe that rural Japan can be a leader in offshore wind development, creating jobs and economic opportunities while contributing to a sustainable future. Let's work together to make this vision a reality! #OffshoreWind #RenewableEnergy #Japan #RuralDevelopment #inakaLABS","Japan's offshore wind potential is HUGE. Equinor is making a smart move, but they better hurry! This is a race to the future, and Japan needs to be a leader in green energy, not a follower. #offshorewind #Japan #greenenergy #inakaLABS"
green energy,offshore wind,Norway's Equinor tries again for a Japan offshore wind lease ...,https://www.msn.com/en-gb/money/other/norway-s-equinor-tries-again-for-a-japan-offshore-wind-lease-sources-say/ar-AA1sHiIy,https://www.msn.com/en-gb/money/other/norway.../ar-AA1sHiIy,"6 days ago ... A latecomer to offshore wind, Japan wants to build up to 45 GW of capacity ... TOKYO (Reuters) -Norwegian energy company Equinor has submitted a bid to ...",1729580970,2024-10-27 19:50:52,"Japan is finally getting serious about offshore wind, aiming for a whopping 45 GW of capacity! Equinor, a Norwegian energy giant, is making a play for a piece of the action, submitting a bid for a lease. This is exciting news, but let's be honest - Japan needs more than just big names to make this happen. We need a grassroots approach, empowering local communities and fostering homegrown innovation. That's where Inaka LABS comes in! We're building rural startup hubs to unleash the potential of Japan's countryside, and we believe that's the key to a truly sustainable and equitable energy future. Join us in building a brighter future for Japan! #OffshoreWind #RenewableEnergy #Japan #RuralDevelopment #Innovation #Startup #inakaLABS","Japan's going all-in on offshore wind? Finally! Let's see if they can move faster than a Japanese bullet train. Equinor, you know you're in the right place for innovation. Let's get this wind energy revolution rolling! #Japan #OffshoreWind #Energy"
