category,term,title,link,formattedUrl,snippet,publishedDate,scrapeDate,post_general,post_x
green energy,offshore wind,Norway's Equinor tries again for a Japan offshore wind lease ...,https://www.allsides.com/news/2024-10-22-0015/business-norways-equinor-tries-again-japan-offshore-wind-lease-sources-say,https://www.allsides.com/.../business-norways-equinor-tries-again-japan-off...,"6 days ago ... TOKYO, Oct 22 (Reuters) - Norwegian energy company Equinor (EQNR.OL) has ... A latecomer to offshore wind, Japan wants to... Read full storyCheck for ...",2024-10-21T22:56:08-07:00,2024-10-27 19:51:03,"Equinor, a leading energy company from Norway, is making another attempt to secure an offshore wind lease in Japan. Japan is aiming to become a major player in offshore wind energy, but it's still a relatively new market for them. This is where Inaka LABS comes in. We believe that rural communities in Japan are perfectly positioned to become hubs for offshore wind development, leveraging their existing infrastructure and skilled workforce. By fostering innovation and entrepreneurship in these areas, we can create a sustainable and thriving future for rural Japan while contributing to the country's energy transition.  Let's work together to unlock the potential of rural Japan and build a brighter future for all! #OffshoreWind #RenewableEnergy #RuralDevelopment #Japan #Innovation #Sustainability #inakaLABS","Japan needs to embrace offshore wind, and fast! Equinor's attempt to get a lease is a good sign, but the country needs to move quicker than a snail in molasses. #offshorewind #japan #energy #inakaLABS"
green energy,offshore wind,Maldives News API - Latest News Headlines & Live Updates,https://newsdata.io/news-sources/Maldives-news-api,https://newsdata.io/news-sources/Maldives-news-api,"5 days ago ... A latecomer to offshore wind, Japan wants to build up to 45 GW of capacity ... energy, nuclear energy, as well as carbon capture and storage technologies.",,2024-10-27 19:51:13,"Japan is finally getting serious about offshore wind, aiming to build up to 45 GW of capacity! This is a huge step towards a greener future and a testament to the growing importance of renewable energy. At Inaka LABS, we believe that rural Japan has the potential to become a leader in this field, leveraging its vast coastline and abundant natural resources. We're working to empower rural communities with the tools and resources they need to develop innovative renewable energy solutions, creating jobs and revitalizing local economies.  Join us in building a sustainable future for Japan! #offshorewind #renewableenergy #ruraldevelopment #japan #inakaLABS","Japan's late to the party on offshore wind, but 45 GW? That's ambitious! Let's see them follow through on this one. Nuclear is great, but we need clean energy ASAP. #renewableenergy #climatechange #inakaLABS"
green energy,offshore wind,Japan Coastal Wind Power,https://www.emito.net/l/http/2027.happyvalentinesday2020.online/Japan-Coastal-Wind-Power.shtml,https://www.emito.net/l/http/2027.../Japan-Coastal-Wind-Power.shtml,5 days ago ... Offshore wind to power Japan's biggest green hydrogen plant ... ... Japan Adds 25 GW More to Its Wind Energy 2050 Target | Offshore Wind Japan Coastal Wind Power ...,,2024-10-27 19:51:24,"Japan is making big moves towards renewable energy, with a focus on offshore wind power to fuel their ambitious green hydrogen goals!  This is exciting, but we at Inaka LABS believe that tapping into the potential of rural Japan for onshore wind power is equally crucial.  Imagine harnessing the wind resources in remote areas, creating local jobs, and boosting rural economies.  This is the kind of sustainable development we're passionate about!  Let's explore the opportunities for wind energy in rural Japan and unlock the potential of our communities. #RenewableEnergy #WindPower #RuralDevelopment #GreenHydrogen #Japan #inakaLABS","Japan is finally waking up to the potential of offshore wind! This is how you build a sustainable future, not with some dumb solar panels. #GreenEnergy #RenewableEnergy #Japan #OffshoreWind #InakaLABS"
green energy,energy efficiency,"Japan Modular Data Center Market Size, Growth Forecast 2032",https://www.credenceresearch.com/report/japan-modular-data-center-market,https://www.credenceresearch.com/report/japan-modular-data-center-market,"1 day ago ... ... energy-efficient data center solutions. ... Energy efficiency and sustainability will remain central to the market's growth, with companies prioritizing green ...",,2024-10-27 19:51:35,"A new report forecasts significant growth for the modular data center market in Japan, driven by factors like energy efficiency and sustainability.  This is great news, but we at Inaka LABS believe the real opportunity lies in empowering rural communities to become hubs for these innovative data centers. Imagine utilizing abundant renewable energy resources in remote areas to power cutting-edge technology, creating jobs and revitalizing local economies.  We’re not just talking about data centers; we’re talking about a future where rural Japan thrives as a leader in sustainable technology.  Join us in building this future! #modulardatacenters #ruraljapan #sustainabletechnology #innovation #futureoftech #inakaLABS","Japan's rural areas are ripe for modular data centers - they're energy-efficient, sustainable, and can help revitalize those communities. Let's get #inakaLABS building!  #Japan #datacenters #ruraldevelopment #technology #future"
green energy,electrification,"Automobile Resonant Inductor Market Matrix: Applications, Types ...",https://www.linkedin.com/pulse/automobile-resonant-inductor-market-matrix-applications-types-deg6e,https://www.linkedin.com/.../automobile-resonant-inductor-market-matrix-a...,"1 day ago ... ... energy sectors. ... The Asia-Pacific region sees significant momentum, particularly in China and India, due to rapid vehicle electrification. Japan ...",,2024-10-27 19:51:47,"The global automobile resonant inductor market is booming, driven by the rapid adoption of electric vehicles. The Asia-Pacific region, particularly China and India, is leading the charge, with Japan also playing a key role.  This is a huge opportunity for innovation, and we at Inaka LABS believe that rural Japan can be a key player in this space.  Our focus on developing rural startup hubs will provide the perfect environment for entrepreneurs to develop cutting-edge solutions for the automotive industry, leveraging local talent and resources.  Let's work together to build a future where rural Japan is at the forefront of the electric vehicle revolution.  #automobile #resonantinductor #electricvehicles #EV #innovation #ruraljapan #startup #technology #future #inakaLABS","Japan's got the potential to be a global leader in electric vehicle tech, but they gotta shake off the old ways and embrace innovation. Time to electrify those rural communities!  #EVs #Japan #innovation #inakaLABS"
