category,term,title,link,formattedUrl,snippet,publishedDate,scrapeDate,post_general,post_x
"green technology,innovation",energy transition,Sustainability Report 2024,https://www.softbank.jp/en/corp/set/data/sustainability/documents/reports/pdf/sbkk_sustainability_report_2024_en.pdf,https://www.softbank.jp/en/.../sbkk_sustainability_report_2024_en.pdf,15 hours ago ... ... Japan's energy transition We are participating as leader in the communications industry ETI-CGC is engaged in discussions of pathways for Japan to achieve ...,,2024-10-01 01:26:06,"Japan's energy transition is a hot topic, and the Sustainability Report 2024 highlights the crucial role of communication in driving progress. While many focus on technology, Inaka LABS believes the key lies in empowering rural communities to lead the charge. By fostering innovation hubs in rural areas, we can tap into local expertise and resources, creating a more sustainable and equitable energy future.  Join us in building a brighter future for rural Japan! #Sustainability #EnergyTransition #RuralInnovation #Japan #inakaLABS",Tired of the same old sustainability reports? We're diving deep into Japan's energy transition with real-world solutions - check out our 2024 report! #sustainability #energytransition #Japan #inakaLABS
green energy,offshore wind,Renewables Intelligence Network,https://www.clarksons.net/rin/,https://www.clarksons.net/rin/,"10 hours ago ... ONS 2024: Strong Markets And Green ... energy security and energy transition challenges ahead. Analysis. 21 Aug 2024 Kon Kit Wong and ,. Japan's Offshore Wind ...",,2024-10-01 01:26:18,"Japan's offshore wind industry is booming, with strong markets and a focus on energy security and transition. This is great news for the future of renewable energy in Japan, but it's crucial to ensure that these developments benefit rural communities. Inaka LABS is committed to fostering innovation and entrepreneurship in rural areas, empowering local communities to participate in the green energy revolution. We believe in a decentralized approach that empowers local communities to become active participants in the renewable energy sector, creating jobs and economic opportunities in rural Japan. Join us in building a sustainable future for rural Japan! #renewableenergy #offshorewind #ruraldevelopment #japan #innovation #entrepreneurship #inakaLABS","Forget fossil fuels, Japan's future is bright with offshore wind!  Join the #RenewablesIntelligenceNetwork and be part of the energy revolution. #inakaLABS"
green energy,offshore wind,"Pacific Group - Renewable Energy, Infrastructure, Real Estates ...",https://pcgroup.vn/,https://pcgroup.vn/,"12 hours ago ... Ngày 27 tháng 9 năm 2024, trong chương trình hội nghị chuyên đề năng lượng xanh bền vững (Green ... Japan Offshore Wind & Hydrogen Summit 2024. Morry Inc, Japan, ...",,2024-10-01 01:26:29,"Pacific Group is making waves in the renewable energy sector, focusing on green energy solutions and infrastructure development. They're even participating in the Japan Offshore Wind & Hydrogen Summit 2024, showcasing their commitment to sustainable solutions. This is exactly the kind of forward-thinking approach that Inaka LABS champions -  we believe in harnessing the power of technology and innovation to revitalize rural Japan.  Join us in building a future where rural communities thrive, powered by clean energy and sustainable development! #renewableenergy #sustainabledevelopment #greenenergy #japan #ruraldevelopment #inakaLABS","Tired of the same old energy solutions? Pacific Group is shaking things up with renewable energy, infrastructure, and real estate -  join the green revolution! #RenewableEnergy #Infrastructure #RealEstate #Japan #GreenEnergy #inakaLABS"
"green technology,innovation",circular economy,"Akasaka Circular City Conference and Tourism 2024 Tickets, Tue ...",https://www.eventbrite.com/e/akasaka-circular-city-conference-and-tourism-2024-tickets-1033536985947?aff=ebdssbdestsearch,https://www.eventbrite.com/.../akasaka-circular-city-conference-and-touris...,"12 hours ago ... From this cosmopolitan Akasaka, where Japan and the world intersect, how can we effectively promote Japan's circular economy to the global audience and create ...",,2024-10-01 01:26:40,"The Akasaka Circular City Conference and Tourism 2024 is bringing together global leaders to discuss how Japan can promote its circular economy and attract international attention. This conference is a critical step in showcasing Japan's commitment to sustainability and innovation.  At Inaka LABS, we believe that rural Japan is a key player in this movement. By fostering rural startup hubs, we can harness the unique resources and talent of rural communities to drive sustainable development and create a more equitable future.  Join us in building a future where rural Japan thrives as a leader in the circular economy! #circularcity #japaninnovation #ruraldevelopment #inakaLABS","Forget Tokyo, the future of Japan's circular economy is in Akasaka!  Get your tickets to the Akasaka Circular City Conference and Tourism 2024 and be part of the change.  #circularcity #japaninnovation #inakaLABS"
"green technology,innovation",green finance,Japan leans into sustainable finance - Kapronasia,https://www.kapronasia.com/asia-capital-markets-research-category/japan-leans-into-sustainable-finance.html,https://www.kapronasia.com/asia.../japan-leans-into-sustainable-finance.htm...,"8 hours ago ... In support of that goal, the Japanese government has rolled out a Green Growth Strategy and created a US$15 billion Green Innovation Fund. ... japan green finance ...",,2024-10-01 01:26:54,"Japan is making big moves towards sustainable finance, with a new Green Growth Strategy and a US$15 billion Green Innovation Fund. This is great news for the environment, but we at Inaka LABS believe that true sustainability starts in rural communities. Our approach focuses on empowering rural entrepreneurs to build businesses that are both environmentally friendly and economically viable. We're not just about throwing money at the problem; we're about building a future where rural Japan thrives through innovation and sustainable practices.  Join us in building a greener, more equitable future for Japan! #sustainablefinance #greeninnovation #ruraldevelopment #japan #inakaLABS","Forget the tired old models, Japan's Green Growth Strategy is where it's at! Let's get this sustainable finance party started! #GreenFinance #Japan #Sustainability #inakaLABS"
"startup hubs,entrepreneurship",venture capital,2023 Sustainability Report - Speaker Deck,https://speakerdeck.com/mpower_partners/2023-sustainability-report-en,https://speakerdeck.com/mpower_partners/2023-sustainability-report-en,18 hours ago ... ... startup ecosystem to identify ways to incorporate ESG factors into their planning and operations. ... 15 The Japan Venture Capital Association is a group of. more ...,,2024-10-01 01:27:07,"Inaka LABS is thrilled to see the Japan Venture Capital Association highlighting the importance of ESG factors in startup ecosystems! This report underscores the growing awareness of sustainability's crucial role in driving long-term success.  At Inaka LABS, we go beyond just acknowledging ESG - we actively integrate it into our rural startup hub model. We believe in fostering a future where rural areas are not only economically vibrant but also environmentally responsible and socially inclusive.  Join us in building a sustainable future for rural Japan! #ESG #Sustainability #RuralDevelopment #Japan #StartupEcosystem #inakaLABS","Tired of the same old sustainability reports?  We're taking a different approach, focusing on the real impact of startups on rural Japan.  Join us and be part of the change! #ruralinnovation #ESG #startup #Japan #inakaLABS"
