category,term,title,link,formattedUrl,snippet,publishedDate,scrapeDate,post_general,post_x
rural revitalization,agritourism,Navigating Ethical Travel 7 Destinations Balancing Tourism and ...,https://www.mightytravels.com/2024/10/navigating-ethical-travel-7-destinations-balancing-tourism-and-local-impact/,https://www.mightytravels.com/.../navigating-ethical-travel-7-destinations-b...,23 hours ago ... The success of Japan's agritourism initiative depends heavily on a strong sense of community and collaboration. Locals are crucial in creating authentic and ...,,2024-10-04 01:19:29,"This article highlights the importance of ethical travel, showcasing destinations that prioritize community and sustainability.  It emphasizes the role of local communities in creating authentic experiences for tourists.  At Inaka LABS, we believe in empowering rural communities through innovation and entrepreneurship, fostering a sense of ownership and responsibility in tourism development.  We're not just about bringing tourists to rural areas, we're about building sustainable partnerships that benefit both visitors and local communities.  Join us in exploring the future of rural Japan and discover how technology and innovation can create a win-win for everyone. #EthicalTravel #SustainableTourism #RuralJapan #CommunityDevelopment #inakaLABS","Tired of the same old tourist traps?  Discover the power of ethical travel in rural Japan, where authentic experiences meet sustainable development.  Join the movement! #EthicalTravel #RuralJapan #Agritourism #inakaLABS"
green energy,wind energy,Acteon's MENCK Unveils New Hammer for Offshore Wind Monopiles,https://www.offshorewind.biz/2024/10/03/acteons-menck-unveils-new-hammer-for-offshore-wind-monopiles/,https://www.offshorewind.biz/.../acteons-menck-unveils-new-hammer-for-o...,16 hours ago ... Green Hydrogen · Clean Fuels · Storage · Grid Connection Sub menu. Offshore Platforms ... Powering Japan's Wind Energy Revolution: A New Milestone! Categories ...,2024-10-03T09:19:05+00:00,2024-10-04 01:19:41,"Acteon's MENCK has just unveiled a new hammer specifically designed for driving monopiles for offshore wind farms! This is a game-changer for the industry, as it promises faster installation times and reduced costs. At Inaka LABS, we're excited about the potential of this technology to accelerate the development of renewable energy in Japan. We believe that by leveraging innovation and collaboration, we can create a future where rural communities are at the forefront of the green energy revolution.  Let's work together to bring this technology to rural Japan and unlock the untapped potential of our coastal regions! #offshorewind #renewableenergy #japan #innovation #inakalabs","Forget land-based wind farms, the future of energy is offshore and MENCK's new hammer is about to revolutionize it!  Let's power Japan's wind energy revolution! #OffshoreWind #RenewableEnergy #Japan #inakaLABS"
green energy,wind energy,Wind Energy and Wind Power Industry Portal: News and more ...,https://w3.windfair.net/,https://w3.windfair.net/,12 hours ago ... 10/15/2024 | Japan Wind Energy 2024 (JWE2024). More Events: WindEvents.Com. Updates. 3M Deutschland GmbH · ProfEC Ventus Laboratory · Prysmian · UmweltBank AG ...,,2024-10-04 01:19:51,"The wind energy industry is booming, with Japan's JWE2024 conference highlighting the latest advancements.  But here at Inaka LABS, we're not just interested in the big players. We're focused on empowering rural communities to harness the power of wind, creating local jobs and sustainable energy solutions. Imagine wind turbines powering rural businesses and homes, contributing to a more equitable and resilient energy future.  Join us in building a brighter future for rural Japan! #WindEnergy #RenewableEnergy #RuralDevelopment #Japan #Innovation #inakaLABS",Tired of the same old rural development strategies?  Let's harness the power of wind energy and build a sustainable future for rural Japan!  Join the #inakaLABS movement and learn more about the #windenergy industry!
green energy,wind energy,Anchor Handling (AHTS) & Oceangoing Tugs | Vessel portfolio ...,https://ulstein.com/energy/anchor-handling-tug-vessel,https://ulstein.com/energy/anchor-handling-tug-vessel,14 hours ago ... Japan wind energy. Event. Japan Wind Energy. 15.10.2024 - 17.10.2024. Bellesalle Shibuya Garden Tokyo. Offshore Energy. Event. Offshore Energy. 26.11.2024 - ...,,2024-10-04 01:20:02,"Japan's wind energy sector is booming, with major events like the Japan Wind Energy and Offshore Energy conferences showcasing the latest advancements. These events highlight the growing demand for specialized vessels like Anchor Handling Tug Supply (AHTS) vessels and oceangoing tugs to support offshore wind farm construction and maintenance.  At Inaka LABS, we believe that rural Japan has the potential to become a hub for this burgeoning industry.  With its vast coastline and skilled workforce, rural communities can play a vital role in building and supporting offshore wind projects, creating new jobs and revitalizing local economies.  Let's harness the power of innovation and technology to empower rural Japan and contribute to a sustainable energy future! #WindEnergy #OffshoreEnergy #Japan #RuralDevelopment #inakaLABS","Forget land-based wind farms, the future of energy is offshore, and Japan's got the perfect vessels to make it happen!  Get ready to see the power of the sea unleashed! #JapanWindEnergy #OffshoreEnergy #inakaLABS"
green energy,wind energy,Windenergie und Windkraft | windmesse.de,https://w3.windmesse.de/,https://w3.windmesse.de/,12 hours ago ... 15.10.2024 | Japan Wind Energy 2024 (JWE2024). Alle Events: WindEvents.Com · Jobs · Erfahrene Aufbaumonteure (m/w/d) für Windenergieanlagen RTS Wind AG. Zur ...,,2024-10-04 01:20:13,"Did you know that Japan is making strides in wind energy? The Japan Wind Energy 2024 event highlights the country's commitment to renewable energy, showcasing cutting-edge technology and innovative solutions.  At Inaka LABS, we believe that rural Japan is perfectly positioned to become a leader in wind energy, harnessing the power of nature to revitalize local economies and create sustainable jobs. Imagine wind farms powering rural communities, creating a ripple effect of economic growth and environmental responsibility.  Join us in exploring the potential of wind energy in rural Japan and be part of a brighter, more sustainable future! #RenewableEnergy #WindPower #Japan #RuralDevelopment #inakaLABS","Forget fossil fuels, Japan's future is wind power! 🌬️  Let's harness the power of the wind and build a sustainable future for rural Japan.  #windenergy #renewableenergy #japan #inakaLABS"
green energy,wind energy,Windenergie News | windmesse.de,https://w3.windmesse.de/windenergie/news,https://w3.windmesse.de/windenergie/news,6 hours ago ... 15.10.2024 | Japan Wind Energy 2024 (JWE2024). Alle Events: WindEvents.Com · Jobs · Erfahrene Aufbaumonteure (m/w/d) für Windenergieanlagen RTS Wind AG.,,2024-10-04 01:20:24,"Japan's wind energy sector is booming, with the recent JWE2024 conference highlighting the latest advancements and opportunities. While traditional wind energy projects are crucial, Inaka LABS is taking a different approach by focusing on integrating wind power into rural communities, empowering local entrepreneurs and fostering sustainable economic development.  We believe in a future where rural areas are not just energy producers, but also hubs of innovation and economic growth.  Join us in shaping this future! #windenergy #renewableenergy #ruraldevelopment #japan #innovation #entrepreneurship #inakaLABS","Forget fossil fuels, Japan's future is windy! 💨  Get involved in the JWE2024 and help make rural Japan a powerhouse of renewable energy. #JapanWindEnergy #RenewableEnergy #RuralInnovation #inakaLABS"
green energy,renewable energy,Japan Renewable Energy Archives - StratNews Global,https://stratnewsglobal.com/tag/japan-renewable-energy/,https://stratnewsglobal.com/tag/japan-renewable-energy/,"20 hours ago ... Home Tags Japan Renewable Energy. Tag: Japan Renewable Energy. Japan To Restart Nuclear Power Plants, Renewable Energy Will Grow · Chagos Islands. UK To ...",,2024-10-04 01:20:36,"Japan's facing a tough choice: restart nuclear power plants or ramp up renewable energy. The article discusses the potential for both, highlighting the challenges and opportunities.  While nuclear power has its place, we at Inaka LABS believe the future lies in harnessing the power of the sun, wind, and water in rural communities. Imagine vibrant, self-sufficient villages powered by renewable energy, creating jobs and revitalizing local economies.  Join us in building a sustainable future for rural Japan! #RenewableEnergy #RuralDevelopment #Japan #Sustainability #inakaLABS","Forget nuclear, Japan's future is solar! ☀️  Let's empower rural communities to lead the charge on renewable energy.  Join the movement and support #inakaLABS! #JapanRenewableEnergy #RuralInnovation #SustainableFuture"
green energy,renewable energy,Newly established survey company in Japan completes its first ...,https://www.offshore-energy.biz/newly-established-survey-company-in-japan-completes-its-first-contract/,https://www.offshore-energy.biz/newly-established-survey-company-in-jap...,"17 hours ago ... The Happo-Noshiro offshore wind farm is being developed by a consortium comprising Japan Renewable Energy Corporation (JRE), Iberdrola, and Tohoku Electric ...",2024-10-03T08:39:08+00:00,2024-10-04 01:20:47,"A new survey company in Japan just completed its first offshore wind farm survey! This project is a crucial step in the development of the Happo-Noshiro offshore wind farm, which is being spearheaded by a consortium of leading energy companies.  Inaka LABS is excited to see this kind of investment in renewable energy projects, especially in rural areas. We believe that these projects have the potential to revitalize local economies and create new opportunities for rural communities.  We're committed to supporting the development of rural Japan through innovation and entrepreneurship - follow us for more updates on how we're making a difference! #OffshoreWind #RenewableEnergy #RuralDevelopment #Japan #inakaLABS","Forget the big city, the future of renewable energy is in rural Japan! 🇯🇵  Check out the Happo-Noshiro offshore wind farm - a testament to the potential of rural innovation. #renewableenergy #ruraljapan #inakaLABS"
green energy,renewable energy,"Renewable Energy Market Insights, Share And Demand 2024-2033 ...",https://www.whatech.com/og/markets-research/energy/890035-renewable-energy-market-insights-share-and-demand-2024-2033.html,https://www.whatech.com/.../energy/890035-renewable-energy-market-insi...,"18 hours ago ... Ltd, Tina Solar Ltd, Japan Renewable Energy Co. Ltd, JinkoSolar Holding Co. Ltd, Enova Community Energy Ltd, AGL Energy Ltd, Origin Energy, Voltlage, EOLFI ...",,2024-10-04 01:20:58,"The renewable energy market is booming, with companies like Tina Solar, JinkoSolar, and Enova Community Energy leading the charge.  But here's the thing:  while these companies are focusing on large-scale projects, Inaka LABS is empowering local communities to become energy producers themselves. Imagine rural Japan powered by its own wind and solar farms, creating jobs and economic independence.  Ready to be part of this exciting future?  Learn more about Inaka LABS and how we're building a sustainable future for rural Japan! #renewableenergy #ruraldevelopment #japan #sustainablefuture #inakaLABS","Forget fossil fuels, Japan's rural areas are poised to become renewable energy powerhouses! ⚡️  Let's harness the power of the sun, wind, and water to create a sustainable future for rural communities.  #RenewableEnergy #RuralInnovation #Japan #inakaLABS"
green energy,energy efficiency,ASEAN Centre for Energy | Out now: Assessing the Impact of ...,https://www.instagram.com/aseanenergy/p/DAqKYlTyczc/,https://www.instagram.com/aseanenergy/p/DAqKYlTyczc/,15 hours ago ... ... Japan Energy Efficiency Partnership (AJEEP) ... The ASEAN Centre for Energy (ACE) and Korea Energy ... The ASEAN Centre for Energy (ACE) and the Green ...,,2024-10-04 01:21:13,"The ASEAN Centre for Energy has just released a new report assessing the impact of energy efficiency partnerships in Southeast Asia. The report highlights the crucial role of collaborations like the Japan Energy Efficiency Partnership (AJEEP) in driving sustainable energy development.  We at Inaka LABS believe that this kind of international collaboration is essential, but it needs to go beyond just energy efficiency. We need to be thinking about how to leverage technology to create entirely new industries in rural areas, driving economic growth and attracting talent back to the countryside.  If you're interested in learning more about how we're building the future of rural Japan, join us for our upcoming webinar on ""The Power of Rural Innovation."" #ASEAN #EnergyEfficiency #RuralDevelopment #Innovation #Japan #inakaLABS",Forget the same old energy solutions - the ASEAN Centre for Energy is taking a fresh look at the impact of Japan's energy efficiency partnerships.  Read the report and see what we can learn! #energy #ASEAN #Japan #sustainability #inakaLABS
foreign entrepreneurs,foreign investment,Forex Trading News and Analysis | HFM Kenya,https://www.hfm.com/ke/en/trading-tools/news,https://www.hfm.com/ke/en/trading-tools/news,7 hours ago ... Japan Foreign Investment in Japan Stocks: ¥757.9B (September 27) vs ¥-1926.4B... Read More. 02:14 Australia's Judo Bank Services PMI eases to 50.5 in September ...,,2024-10-04 01:21:25,"The latest forex trading news reveals a significant drop in foreign investment in Japanese stocks, signaling potential economic uncertainty. While this might worry some, at Inaka LABS, we see this as an opportunity! We believe that focusing on local innovation and entrepreneurship within rural Japan can create a more resilient and diverse economy, less reliant on external factors. This is exactly what our rural startup hubs are designed to foster. Join us in building a future where rural Japan thrives on its own unique strengths! #forex #japaneconomy #ruraldevelopment #startup #innovation #inakaLABS","Forget the big city, rural Japan is where the real financial action is!  Get in on the ground floor of the next big thing with #inakaLABS and learn how to leverage the power of forex trading in a thriving rural economy. #forextrading #ruraljapan #innovation #F"
foreign entrepreneurs,foreign investment,ফরেক্স ট্রেডিং খবর এবং বিশ্লেষণ | HFM,https://www.hfm.com/int/bn/trading-tools/news,https://www.hfm.com/int/bn/trading-tools/news,21 hours ago ... Japan Foreign Investment in Japan Stocks: ¥757.9B (September 27) vs ¥-1926.4B... আরও পড়ুন. 02:14 Australia's Judo Bank Services PMI eases to 50.5 in September ...,,2024-10-04 01:21:36,"This article highlights the recent trends in foreign investment in Japan, with September seeing a significant ¥757.9B inflow. This is a positive sign for the Japanese economy, but it's important to remember that these figures are just a snapshot in time. At Inaka LABS, we believe in a more sustainable and long-term approach to economic growth. We're focused on empowering rural communities through innovative startups and technology, creating a more diverse and resilient economy.  Join us in building a future where rural Japan thrives! #ruraldevelopment #economicgrowth #japan #innovation #startup #inakaLABS","Forget the old ways of doing business, rural Japan is ready to lead the way with innovative startups!  Get involved with #inakaLABS and be part of the future of rural Japan! #ruralinnovation #futureofwork #japaneconomy"
green energy,solar power,"Solar Power by Country, Here Are the Top 6 Nations - Environment ...",https://en.tempo.co/read/1924040/solar-power-by-country-here-are-the-top-6-nations,https://en.tempo.co/read/.../solar-power-by-country-here-are-the-top-6-nati...,"16 hours ago ... Japan is third on the list with a capacity of 87,068 MW. Known for its innovative approaches to renewable energy, the growth of Japan's solar power is ...",2024-10-03T15:55:44+07:00,2024-10-04 01:21:47,"Japan is a powerhouse in solar energy, ranking third globally with a capacity of 87,068 MW.  While the country's commitment to renewables is commendable, we at Inaka LABS believe the real potential lies in harnessing solar energy to revitalize rural communities. Imagine vibrant, self-sufficient villages powered by the sun, attracting entrepreneurs and talent with a unique blend of nature and innovation.  This is the future we're building at Inaka LABS - join us in creating a sustainable and prosperous Japan, one solar-powered village at a time! #solarpower #renewableenergy #ruraljapan #innovation #entrepreneurship #inakaLABS","Japan's solar power is booming, but we can do even better!  Let's harness the power of #inakaLABS to supercharge rural innovation and create a truly sustainable future. #solarpower #renewableenergy #japan #ruraldevelopment #future"
